{
  "$comment": "Generated by npm run generate:schema from src/manifest/environment.ts. Do not edit manually.",
  "$schema": "https://json-schema.org/draft/2020-12/schema",
  "type": "object",
  "properties": {
    "device": {
      "$ref": "#/$defs/__schema0"
    },
    "display": {
      "$ref": "#/$defs/__schema2"
    },
    "versions": {
      "$ref": "#/$defs/__schema6"
    },
    "unavailable": {
      "$ref": "#/$defs/__schema7"
    }
  },
  "required": [
    "device",
    "display",
    "versions",
    "unavailable"
  ],
  "additionalProperties": false,
  "description": "Environment compatibility observations. Every field is explicit; each null requires exactly one unavailable reason. Complete semantic validation uses environmentSchema.",
  "$defs": {
    "__schema0": {
      "type": "object",
      "properties": {
        "platform": {
          "anyOf": [
            {
              "$ref": "#/$defs/__schema1"
            },
            {
              "type": "null"
            }
          ]
        },
        "identity": {
          "anyOf": [
            {
              "type": "object",
              "properties": {
                "scope": {
                  "description": "Stable local host/provider and simulator-set scope established by the capture adapter.",
                  "$ref": "#/$defs/__schema1"
                },
                "id": {
                  "description": "Persistent device identity within that scope; an emulator port or display name alone is insufficient.",
                  "$ref": "#/$defs/__schema1"
                }
              },
              "required": [
                "scope",
                "id"
              ],
              "additionalProperties": false
            },
            {
              "type": "null"
            }
          ]
        },
        "osVersion": {
          "anyOf": [
            {
              "$ref": "#/$defs/__schema1"
            },
            {
              "type": "null"
            }
          ]
        }
      },
      "required": [
        "platform",
        "identity",
        "osVersion"
      ],
      "additionalProperties": false
    },
    "__schema1": {
      "type": "string",
      "pattern": "\\S"
    },
    "__schema2": {
      "type": "object",
      "properties": {
        "pixelWidth": {
          "anyOf": [
            {
              "$ref": "#/$defs/__schema3"
            },
            {
              "type": "null"
            }
          ],
          "description": "Active display pixel width at the observed rotation, before screenshot resizing or cropping."
        },
        "pixelHeight": {
          "anyOf": [
            {
              "$ref": "#/$defs/__schema3"
            },
            {
              "type": "null"
            }
          ],
          "description": "Active display pixel height at the observed rotation, before screenshot resizing or cropping."
        },
        "pixelDensity": {
          "anyOf": [
            {
              "$ref": "#/$defs/__schema4"
            },
            {
              "type": "null"
            }
          ],
          "description": "Native UI scale, such as iOS 3 or Android 440/160. Not a rectangle projection multiplier."
        },
        "rotation": {
          "anyOf": [
            {
              "type": "string",
              "enum": [
                "portrait",
                "portrait-upside-down",
                "landscape-left",
                "landscape-right"
              ]
            },
            {
              "type": "null"
            }
          ]
        },
        "appearance": {
          "anyOf": [
            {
              "$ref": "#/$defs/__schema5"
            },
            {
              "type": "null"
            }
          ],
          "description": "Observed effective appearance; an automatic-mode preference alone is insufficient."
        },
        "textSize": {
          "anyOf": [
            {
              "oneOf": [
                {
                  "type": "object",
                  "properties": {
                    "kind": {
                      "type": "string",
                      "const": "ios-content-size"
                    },
                    "value": {
                      "type": "string",
                      "enum": [
                        "extra-small",
                        "small",
                        "medium",
                        "large",
                        "extra-large",
                        "extra-extra-large",
                        "extra-extra-extra-large",
                        "accessibility-medium",
                        "accessibility-large",
                        "accessibility-extra-large",
                        "accessibility-extra-extra-large",
                        "accessibility-extra-extra-extra-large"
                      ]
                    }
                  },
                  "required": [
                    "kind",
                    "value"
                  ],
                  "additionalProperties": false
                },
                {
                  "type": "object",
                  "properties": {
                    "kind": {
                      "type": "string",
                      "const": "android-font-scale"
                    },
                    "value": {
                      "type": "number",
                      "exclusiveMinimum": 0
                    }
                  },
                  "required": [
                    "kind",
                    "value"
                  ],
                  "additionalProperties": false
                },
                {
                  "type": "object",
                  "properties": {
                    "kind": {
                      "type": "string",
                      "const": "platform-native"
                    },
                    "unit": {
                      "$ref": "#/$defs/__schema1"
                    },
                    "value": {
                      "$ref": "#/$defs/__schema1"
                    }
                  },
                  "required": [
                    "kind",
                    "unit",
                    "value"
                  ],
                  "additionalProperties": false
                }
              ]
            },
            {
              "type": "null"
            }
          ]
        }
      },
      "required": [
        "pixelWidth",
        "pixelHeight",
        "pixelDensity",
        "rotation",
        "appearance",
        "textSize"
      ],
      "additionalProperties": false
    },
    "__schema3": {
      "type": "integer",
      "exclusiveMinimum": 0,
      "maximum": 9007199254740991
    },
    "__schema4": {
      "type": "number",
      "exclusiveMinimum": 0
    },
    "__schema5": {
      "type": "string",
      "enum": [
        "light",
        "dark"
      ]
    },
    "__schema6": {
      "type": "object",
      "properties": {
        "deviceProof": {
          "anyOf": [
            {
              "$ref": "#/$defs/__schema1"
            },
            {
              "type": "null"
            }
          ]
        },
        "agentDevice": {
          "anyOf": [
            {
              "$ref": "#/$defs/__schema1"
            },
            {
              "type": "null"
            }
          ]
        }
      },
      "required": [
        "deviceProof",
        "agentDevice"
      ],
      "additionalProperties": false
    },
    "__schema7": {
      "type": "array",
      "items": {
        "type": "object",
        "properties": {
          "path": {
            "anyOf": [
              {
                "type": "array",
                "prefixItems": [
                  {
                    "type": "string",
                    "const": "device"
                  },
                  {
                    "type": "string",
                    "const": "platform"
                  }
                ],
                "items": false,
                "minItems": 2,
                "maxItems": 2
              },
              {
                "type": "array",
                "prefixItems": [
                  {
                    "type": "string",
                    "const": "device"
                  },
                  {
                    "type": "string",
                    "const": "identity"
                  }
                ],
                "items": false,
                "minItems": 2,
                "maxItems": 2
              },
              {
                "type": "array",
                "prefixItems": [
                  {
                    "type": "string",
                    "const": "device"
                  },
                  {
                    "type": "string",
                    "const": "osVersion"
                  }
                ],
                "items": false,
                "minItems": 2,
                "maxItems": 2
              },
              {
                "type": "array",
                "prefixItems": [
                  {
                    "type": "string",
                    "const": "display"
                  },
                  {
                    "type": "string",
                    "const": "pixelWidth"
                  }
                ],
                "items": false,
                "minItems": 2,
                "maxItems": 2
              },
              {
                "type": "array",
                "prefixItems": [
                  {
                    "type": "string",
                    "const": "display"
                  },
                  {
                    "type": "string",
                    "const": "pixelHeight"
                  }
                ],
                "items": false,
                "minItems": 2,
                "maxItems": 2
              },
              {
                "type": "array",
                "prefixItems": [
                  {
                    "type": "string",
                    "const": "display"
                  },
                  {
                    "type": "string",
                    "const": "pixelDensity"
                  }
                ],
                "items": false,
                "minItems": 2,
                "maxItems": 2
              },
              {
                "type": "array",
                "prefixItems": [
                  {
                    "type": "string",
                    "const": "display"
                  },
                  {
                    "type": "string",
                    "const": "rotation"
                  }
                ],
                "items": false,
                "minItems": 2,
                "maxItems": 2
              },
              {
                "type": "array",
                "prefixItems": [
                  {
                    "type": "string",
                    "const": "display"
                  },
                  {
                    "type": "string",
                    "const": "appearance"
                  }
                ],
                "items": false,
                "minItems": 2,
                "maxItems": 2
              },
              {
                "type": "array",
                "prefixItems": [
                  {
                    "type": "string",
                    "const": "display"
                  },
                  {
                    "type": "string",
                    "const": "textSize"
                  }
                ],
                "items": false,
                "minItems": 2,
                "maxItems": 2
              },
              {
                "type": "array",
                "prefixItems": [
                  {
                    "type": "string",
                    "const": "versions"
                  },
                  {
                    "type": "string",
                    "const": "deviceProof"
                  }
                ],
                "items": false,
                "minItems": 2,
                "maxItems": 2
              },
              {
                "type": "array",
                "prefixItems": [
                  {
                    "type": "string",
                    "const": "versions"
                  },
                  {
                    "type": "string",
                    "const": "agentDevice"
                  }
                ],
                "items": false,
                "minItems": 2,
                "maxItems": 2
              }
            ]
          },
          "message": {
            "$ref": "#/$defs/__schema1"
          }
        },
        "required": [
          "path",
          "message"
        ],
        "additionalProperties": false
      }
    }
  }
}
